{
  "id": "natrinai_094",
  "poem": "natrinai",
  "tinai": "neytal",
  "sangamTamil": "நோய் அலைக் கலங்கிய மதன் அழி பொழுதில்,\nகாமம் செப்பல் ஆண்மகற்கு அமையும்;\nயானே, பெண்மை தட்ப நுண்ணிதின் தாங்கி-\nகை வல் கம்மியன் கவின் பெறக் கழாஅ\nமண்ணாப் பசு முத்து ஏய்ப்ப, குவி இணர்ப்\nபுன்னை அரும்பிய புலவு நீர்ச் சேர்ப்பன்\nஎன்ன மகன்கொல்- தோழி!- தன்வயின்\nஆர்வம் உடையர் ஆகி,\nமார்பு அணங்குறுநரை அறியாதோனே!\n- இளந்திரையனார்.",
  "urai": "தோழி! காமநோயானது நிலைகுலைத்தலாலே கலக்கமுற்ற வலியழிந்த பொழுதில் அன்போடு வந்து அருகிலிருந்து நயமொழி கூறி ஆற்றுவித்தல் ஆண்மகனுக்குரிய சிறந்த பண்பாகும், அங்ஙனம் யான் காமநோயால் வருந்திய பொழுது நம் காதலன் அருகு வந்திருந்து ஆற்றினானுமல்லன்; கைத்தொழில் வல்ல கம்மியன் அழகு பொருந்தக் கழுவித் தூய்மை செய்யாத பசிய முத்து தனது மிக்க ஒளியை மறைத்துக் காட்டினாற்போல; யானும் புணர்ச்சியால் நிகழ்ந்த மிக்க நலனைப் புலப்படாமல் அரிதாகத் தாங்கி என் பெண் தன்மையாலே தகைத்துக்கொள்ளும்படியாக; அலராமற் குவிந்த பூங்ககொத்துக்களையுடைய புன்னையின் கண்ணே புலவு நாற்றத்தையுடைய நீர் தெறித்தலான் மலர்ந்த கடற்கரைத் தலைவனாகிய; முன்னமே அவன்பால் ஆர்வமுடையேனாக வேண்டி அவனது மார்பால் வருத்தமுற்ற என் இயல்பை அறியாத காதலன் என்ன மகன் எனக் கூறப்படுவானோ?",
  "english": null,
  "lines": [
    {
      "lineNumber": 1,
      "text": "நோய் அலைக் கலங்கிய மதன் அழி பொழுதில்,",
      "words": [
        {
          "form": "நோய்",
          "root": null,
          "urichol": null,
          "etymology": null,
          "gloss": null
        },
        {
          "form": "அலைக்",
          "root": null,
          "urichol": null,
          "etymology": null,
          "gloss": null
        },
        {
          "form": "கலங்கிய",
          "root": null,
          "urichol": null,
          "etymology": null,
          "gloss": null
        },
        {
          "form": "மதன்",
          "root": null,
          "urichol": null,
          "etymology": null,
          "gloss": null
        },
        {
          "form": "அழி",
          "root": null,
          "urichol": null,
          "etymology": null,
          "gloss": null
        },
        {
          "form": "பொழுதில்,",
          "root": null,
          "urichol": null,
          "etymology": null,
          "gloss": null
        }
      ]
    },
    {
      "lineNumber": 2,
      "text": "காமம் செப்பல் ஆண்மகற்கு அமையும்;",
      "words": [
        {
          "form": "காமம்",
          "root": null,
          "urichol": null,
          "etymology": null,
          "gloss": null
        },
        {
          "form": "செப்பல்",
          "root": null,
          "urichol": null,
          "etymology": null,
          "gloss": null
        },
        {
          "form": "ஆண்மகற்கு",
          "root": null,
          "urichol": null,
          "etymology": null,
          "gloss": null
        },
        {
          "form": "அமையும்;",
          "root": null,
          "urichol": null,
          "etymology": null,
          "gloss": null
        }
      ]
    },
    {
      "lineNumber": 3,
      "text": "யானே, பெண்மை தட்ப நுண்ணிதின் தாங்கி-",
      "words": [
        {
          "form": "யானே,",
          "root": null,
          "urichol": null,
          "etymology": null,
          "gloss": null
        },
        {
          "form": "பெண்மை",
          "root": null,
          "urichol": null,
          "etymology": null,
          "gloss": null
        },
        {
          "form": "தட்ப",
          "root": null,
          "urichol": null,
          "etymology": null,
          "gloss": null
        },
        {
          "form": "நுண்ணிதின்",
          "root": null,
          "urichol": null,
          "etymology": null,
          "gloss": null
        },
        {
          "form": "தாங்கி-",
          "root": null,
          "urichol": null,
          "etymology": null,
          "gloss": null
        }
      ]
    },
    {
      "lineNumber": 4,
      "text": "கை வல் கம்மியன் கவின் பெறக் கழாஅ",
      "words": [
        {
          "form": "கை",
          "root": null,
          "urichol": null,
          "etymology": null,
          "gloss": null
        },
        {
          "form": "வல்",
          "root": null,
          "urichol": null,
          "etymology": null,
          "gloss": null
        },
        {
          "form": "கம்மியன்",
          "root": null,
          "urichol": null,
          "etymology": null,
          "gloss": null
        },
        {
          "form": "கவின்",
          "root": null,
          "urichol": null,
          "etymology": null,
          "gloss": null
        },
        {
          "form": "பெறக்",
          "root": null,
          "urichol": null,
          "etymology": null,
          "gloss": null
        },
        {
          "form": "கழாஅ",
          "root": null,
          "urichol": null,
          "etymology": null,
          "gloss": null
        }
      ]
    },
    {
      "lineNumber": 5,
      "text": "மண்ணாப் பசு முத்து ஏய்ப்ப, குவி இணர்ப்",
      "words": [
        {
          "form": "மண்ணாப்",
          "root": null,
          "urichol": null,
          "etymology": null,
          "gloss": null
        },
        {
          "form": "பசு",
          "root": null,
          "urichol": null,
          "etymology": null,
          "gloss": null
        },
        {
          "form": "முத்து",
          "root": null,
          "urichol": null,
          "etymology": null,
          "gloss": null
        },
        {
          "form": "ஏய்ப்ப,",
          "root": null,
          "urichol": null,
          "etymology": null,
          "gloss": null
        },
        {
          "form": "குவி",
          "root": null,
          "urichol": null,
          "etymology": null,
          "gloss": null
        },
        {
          "form": "இணர்ப்",
          "root": null,
          "urichol": null,
          "etymology": null,
          "gloss": null
        }
      ]
    },
    {
      "lineNumber": 6,
      "text": "புன்னை அரும்பிய புலவு நீர்ச் சேர்ப்பன்",
      "words": [
        {
          "form": "புன்னை",
          "root": null,
          "urichol": null,
          "etymology": null,
          "gloss": null
        },
        {
          "form": "அரும்பிய",
          "root": null,
          "urichol": null,
          "etymology": null,
          "gloss": null
        },
        {
          "form": "புலவு",
          "root": null,
          "urichol": null,
          "etymology": null,
          "gloss": null
        },
        {
          "form": "நீர்ச்",
          "root": null,
          "urichol": null,
          "etymology": null,
          "gloss": null
        },
        {
          "form": "சேர்ப்பன்",
          "root": null,
          "urichol": null,
          "etymology": null,
          "gloss": null
        }
      ]
    },
    {
      "lineNumber": 7,
      "text": "என்ன மகன்கொல்- தோழி!- தன்வயின்",
      "words": [
        {
          "form": "என்ன",
          "root": null,
          "urichol": null,
          "etymology": null,
          "gloss": null
        },
        {
          "form": "மகன்கொல்-",
          "root": null,
          "urichol": null,
          "etymology": null,
          "gloss": null
        },
        {
          "form": "தோழி!-",
          "root": null,
          "urichol": null,
          "etymology": null,
          "gloss": null
        },
        {
          "form": "தன்வயின்",
          "root": null,
          "urichol": null,
          "etymology": null,
          "gloss": null
        }
      ]
    },
    {
      "lineNumber": 8,
      "text": "ஆர்வம் உடையர் ஆகி,",
      "words": [
        {
          "form": "ஆர்வம்",
          "root": null,
          "urichol": null,
          "etymology": null,
          "gloss": null
        },
        {
          "form": "உடையர்",
          "root": null,
          "urichol": null,
          "etymology": null,
          "gloss": null
        },
        {
          "form": "ஆகி,",
          "root": null,
          "urichol": null,
          "etymology": null,
          "gloss": null
        }
      ]
    },
    {
      "lineNumber": 9,
      "text": "மார்பு அணங்குறுநரை அறியாதோனே!",
      "words": [
        {
          "form": "மார்பு",
          "root": null,
          "urichol": null,
          "etymology": null,
          "gloss": null
        },
        {
          "form": "அணங்குறுநரை",
          "root": null,
          "urichol": null,
          "etymology": null,
          "gloss": null
        },
        {
          "form": "அறியாதோனே!",
          "root": null,
          "urichol": null,
          "etymology": null,
          "gloss": null
        }
      ]
    },
    {
      "lineNumber": 10,
      "text": "- இளந்திரையனார்.",
      "words": [
        {
          "form": "-",
          "root": null,
          "urichol": null,
          "etymology": null,
          "gloss": null
        },
        {
          "form": "இளந்திரையனார்.",
          "root": null,
          "urichol": null,
          "etymology": null,
          "gloss": null
        }
      ]
    }
  ],
  "culturalNotes": [],
  "audioUrl": null,
  "source": "http://www.sangathamizh.com/8thokai/natrinai/natrinai-நற்றிணை094.html",
  "verified": false,
  "number": 94,
  "poet": "இளந்திரையனார்.",
  "title": "புன்னை மலரும் துறைவனின் ஈடற்ற செயல்"
}