{
  "id": "perumpanatrupadai_04",
  "poem": "perumpanatrupadai",
  "tinai": "unknown",
  "sangamTamil": "இரு நிலம் கடந்த திரு மறு மார்பின்\nமுந்நீர் வண்ணன் பிறங்கடை அ நீர்\nதிரை தரு மரபின் உரவோன் உம்பல்\nமலர் தலை உலகத்து மன் உயிர் காக்கும்\nமுரசு முழங்கு தானை மூவருள்ளும்\nஇலங்கு நீர் பரப்பின் வளை மீக்கூறும்\nவலம்புரி அன்ன வசை நீங்கு சிறப்பின்\nஅல்லது கடிந்த அறம் புரி செங்கோல்\nபல் வேல் திரையன் படர்குவிர் ஆயின்",
  "urai": "திரையன் திருமாலின் வலம்புரிச் சங்கம் போன்றவன். அவன் திரையர் குடியில் தோன்றிய திரையன். பலவகையான வேல்களைப் பல்வேறு விசைப் பாங்குகளில் வீசக்கூடியவன். அவன் திருமாலின் பிறங்கடை (வாரிசு). திருமால் நிலத்தைக் கடந்தவர். செல்வத் திருமகள் அமர்ந்து மணம் வீசும் மார்பினை உடையவர். கடல் நிறத்தில் காட்சி தருபவர். கடலின் திரையில் (அலையில்) மிதந்து வந்து அரசுக்கட்டில் ஏறிய அரச மரபினரின் கால்வழியினர் திரையர் எனப்பட்டனர். அம்மரபில் வந்தவர்களில் உயர்ந்தோங்கிய யானை போன்றவன், இந்தத் தொண்டைமான் இளந்திரையன். (தொண்டைமான் இளந்திரையன் கடலில் தொண்டைக் கொடியுடன் மிதந்து வந்தான் என்னும் கதைக்குத் தளப்பகுதி இது) உலகிலுள்ள உயிரினங்களைக் காக்கும் மூவேந்தர்களைச் சங்கு என்றால் இந்த இளந்திரையன் அச் சங்குகளிலே சிறந்து விளங்கும் வலம்புரிச் சங்கு போன்றவன். மறப்போரை விலக்கிவிட்டு அறத்தை மட்டுமே செய்யும் செங்கோல்தான் அவன் ஆட்சி. நீங்களும் அவனை நினைத்துக்கொண்டு செல்லுங்கள். (வறுமை தீரும் வளங்களைப் பெறலாம்).",
  "english": null,
  "lines": [
    {
      "lineNumber": 1,
      "text": "இரு நிலம் கடந்த திரு மறு மார்பின்",
      "words": [
        {
          "form": "இரு",
          "root": null,
          "urichol": null,
          "etymology": null,
          "gloss": null
        },
        {
          "form": "நிலம்",
          "root": null,
          "urichol": null,
          "etymology": null,
          "gloss": null
        },
        {
          "form": "கடந்த",
          "root": null,
          "urichol": null,
          "etymology": null,
          "gloss": null
        },
        {
          "form": "திரு",
          "root": null,
          "urichol": null,
          "etymology": null,
          "gloss": null
        },
        {
          "form": "மறு",
          "root": null,
          "urichol": null,
          "etymology": null,
          "gloss": null
        },
        {
          "form": "மார்பின்",
          "root": null,
          "urichol": null,
          "etymology": null,
          "gloss": null
        }
      ]
    },
    {
      "lineNumber": 2,
      "text": "முந்நீர் வண்ணன் பிறங்கடை அ நீர்",
      "words": [
        {
          "form": "முந்நீர்",
          "root": null,
          "urichol": null,
          "etymology": null,
          "gloss": null
        },
        {
          "form": "வண்ணன்",
          "root": null,
          "urichol": null,
          "etymology": null,
          "gloss": null
        },
        {
          "form": "பிறங்கடை",
          "root": null,
          "urichol": null,
          "etymology": null,
          "gloss": null
        },
        {
          "form": "அ",
          "root": null,
          "urichol": null,
          "etymology": null,
          "gloss": null
        },
        {
          "form": "நீர்",
          "root": null,
          "urichol": null,
          "etymology": null,
          "gloss": null
        }
      ]
    },
    {
      "lineNumber": 3,
      "text": "திரை தரு மரபின் உரவோன் உம்பல்",
      "words": [
        {
          "form": "திரை",
          "root": null,
          "urichol": null,
          "etymology": null,
          "gloss": null
        },
        {
          "form": "தரு",
          "root": null,
          "urichol": null,
          "etymology": null,
          "gloss": null
        },
        {
          "form": "மரபின்",
          "root": null,
          "urichol": null,
          "etymology": null,
          "gloss": null
        },
        {
          "form": "உரவோன்",
          "root": null,
          "urichol": null,
          "etymology": null,
          "gloss": null
        },
        {
          "form": "உம்பல்",
          "root": null,
          "urichol": null,
          "etymology": null,
          "gloss": null
        }
      ]
    },
    {
      "lineNumber": 4,
      "text": "மலர் தலை உலகத்து மன் உயிர் காக்கும்",
      "words": [
        {
          "form": "மலர்",
          "root": null,
          "urichol": null,
          "etymology": null,
          "gloss": null
        },
        {
          "form": "தலை",
          "root": null,
          "urichol": null,
          "etymology": null,
          "gloss": null
        },
        {
          "form": "உலகத்து",
          "root": null,
          "urichol": null,
          "etymology": null,
          "gloss": null
        },
        {
          "form": "மன்",
          "root": null,
          "urichol": null,
          "etymology": null,
          "gloss": null
        },
        {
          "form": "உயிர்",
          "root": null,
          "urichol": null,
          "etymology": null,
          "gloss": null
        },
        {
          "form": "காக்கும்",
          "root": null,
          "urichol": null,
          "etymology": null,
          "gloss": null
        }
      ]
    },
    {
      "lineNumber": 5,
      "text": "முரசு முழங்கு தானை மூவருள்ளும்",
      "words": [
        {
          "form": "முரசு",
          "root": null,
          "urichol": null,
          "etymology": null,
          "gloss": null
        },
        {
          "form": "முழங்கு",
          "root": null,
          "urichol": null,
          "etymology": null,
          "gloss": null
        },
        {
          "form": "தானை",
          "root": null,
          "urichol": null,
          "etymology": null,
          "gloss": null
        },
        {
          "form": "மூவருள்ளும்",
          "root": null,
          "urichol": null,
          "etymology": null,
          "gloss": null
        }
      ]
    },
    {
      "lineNumber": 6,
      "text": "இலங்கு நீர் பரப்பின் வளை மீக்கூறும்",
      "words": [
        {
          "form": "இலங்கு",
          "root": null,
          "urichol": null,
          "etymology": null,
          "gloss": null
        },
        {
          "form": "நீர்",
          "root": null,
          "urichol": null,
          "etymology": null,
          "gloss": null
        },
        {
          "form": "பரப்பின்",
          "root": null,
          "urichol": null,
          "etymology": null,
          "gloss": null
        },
        {
          "form": "வளை",
          "root": null,
          "urichol": null,
          "etymology": null,
          "gloss": null
        },
        {
          "form": "மீக்கூறும்",
          "root": null,
          "urichol": null,
          "etymology": null,
          "gloss": null
        }
      ]
    },
    {
      "lineNumber": 7,
      "text": "வலம்புரி அன்ன வசை நீங்கு சிறப்பின்",
      "words": [
        {
          "form": "வலம்புரி",
          "root": null,
          "urichol": null,
          "etymology": null,
          "gloss": null
        },
        {
          "form": "அன்ன",
          "root": null,
          "urichol": null,
          "etymology": null,
          "gloss": null
        },
        {
          "form": "வசை",
          "root": null,
          "urichol": null,
          "etymology": null,
          "gloss": null
        },
        {
          "form": "நீங்கு",
          "root": null,
          "urichol": null,
          "etymology": null,
          "gloss": null
        },
        {
          "form": "சிறப்பின்",
          "root": null,
          "urichol": null,
          "etymology": null,
          "gloss": null
        }
      ]
    },
    {
      "lineNumber": 8,
      "text": "அல்லது கடிந்த அறம் புரி செங்கோல்",
      "words": [
        {
          "form": "அல்லது",
          "root": null,
          "urichol": null,
          "etymology": null,
          "gloss": null
        },
        {
          "form": "கடிந்த",
          "root": null,
          "urichol": null,
          "etymology": null,
          "gloss": null
        },
        {
          "form": "அறம்",
          "root": null,
          "urichol": null,
          "etymology": null,
          "gloss": null
        },
        {
          "form": "புரி",
          "root": null,
          "urichol": null,
          "etymology": null,
          "gloss": null
        },
        {
          "form": "செங்கோல்",
          "root": null,
          "urichol": null,
          "etymology": null,
          "gloss": null
        }
      ]
    },
    {
      "lineNumber": 9,
      "text": "பல் வேல் திரையன் படர்குவிர் ஆயின்",
      "words": [
        {
          "form": "பல்",
          "root": null,
          "urichol": null,
          "etymology": null,
          "gloss": null
        },
        {
          "form": "வேல்",
          "root": null,
          "urichol": null,
          "etymology": null,
          "gloss": null
        },
        {
          "form": "திரையன்",
          "root": null,
          "urichol": null,
          "etymology": null,
          "gloss": null
        },
        {
          "form": "படர்குவிர்",
          "root": null,
          "urichol": null,
          "etymology": null,
          "gloss": null
        },
        {
          "form": "ஆயின்",
          "root": null,
          "urichol": null,
          "etymology": null,
          "gloss": null
        }
      ]
    }
  ],
  "culturalNotes": [],
  "audioUrl": null,
  "source": "http://www.sangathamizh.com/10paddu/perumpanatruppadai/perumpanatruppadai-பெரும்பாணாற்றுப்படை04.html",
  "verified": false,
  "sectionNumber": 4,
  "title": "இளந்திரையனது சிறப்பை அறிவித்தல்",
  "lineStart": 29,
  "lineEnd": 37
}
