{
  "id": "kurunthokai_127",
  "poem": "kurunthokai",
  "tinai": "marutam",
  "sangamTamil": "குருகு கொளக் குளித்த கெண்டை அயலது\nஉரு கெழு தாமரை வால் முகை வெரூஉம்\nகழனிஅம் படப்பைக் காஞ்சி ஊர!\nஒரு நின் பாணன் பொய்யன் ஆக,\nஉள்ள பாணர் எல்லாம்\nகள்வர் போல்வர், நீ அகன்றிசி னோர்க்கே.\n- ஓரம் போகியார்.",
  "urai": "நாரை கவர்ந்து கொள்ள அதன் வாயினின்று தப்பி நீருட் குளித்த கெண்டை மீன் பின்பு அயலதாகிய நிறம் பொருந்திய தாமரையின் வெள்ளிய அரும்பை அஞ்சும் வயற் பக்கங்களையுடைய காஞ்சி மரங்கள் வளர்ந்த ஊரையுடைய தலைவ நின்பாணன் ஒருவன் பொய் பேசுவா னாயினமையால் மற்றுள்ள பாணர்கள் யாவரும் நீ அகன்றதனால் தனித்திருக்கும் மகளிருக்கு பொய்யரைப் போலத் தோற்றுவர்.",
  "english": null,
  "lines": [
    {
      "lineNumber": 1,
      "text": "குருகு கொளக் குளித்த கெண்டை அயலது",
      "words": [
        {
          "form": "குருகு",
          "root": null,
          "urichol": null,
          "etymology": null,
          "gloss": null
        },
        {
          "form": "கொளக்",
          "root": null,
          "urichol": null,
          "etymology": null,
          "gloss": null
        },
        {
          "form": "குளித்த",
          "root": null,
          "urichol": null,
          "etymology": null,
          "gloss": null
        },
        {
          "form": "கெண்டை",
          "root": null,
          "urichol": null,
          "etymology": null,
          "gloss": null
        },
        {
          "form": "அயலது",
          "root": null,
          "urichol": null,
          "etymology": null,
          "gloss": null
        }
      ]
    },
    {
      "lineNumber": 2,
      "text": "உரு கெழு தாமரை வால் முகை வெரூஉம்",
      "words": [
        {
          "form": "உரு",
          "root": null,
          "urichol": null,
          "etymology": null,
          "gloss": null
        },
        {
          "form": "கெழு",
          "root": null,
          "urichol": null,
          "etymology": null,
          "gloss": null
        },
        {
          "form": "தாமரை",
          "root": null,
          "urichol": null,
          "etymology": null,
          "gloss": null
        },
        {
          "form": "வால்",
          "root": null,
          "urichol": null,
          "etymology": null,
          "gloss": null
        },
        {
          "form": "முகை",
          "root": null,
          "urichol": null,
          "etymology": null,
          "gloss": null
        },
        {
          "form": "வெரூஉம்",
          "root": null,
          "urichol": null,
          "etymology": null,
          "gloss": null
        }
      ]
    },
    {
      "lineNumber": 3,
      "text": "கழனிஅம் படப்பைக் காஞ்சி ஊர!",
      "words": [
        {
          "form": "கழனிஅம்",
          "root": null,
          "urichol": null,
          "etymology": null,
          "gloss": null
        },
        {
          "form": "படப்பைக்",
          "root": null,
          "urichol": null,
          "etymology": null,
          "gloss": null
        },
        {
          "form": "காஞ்சி",
          "root": null,
          "urichol": null,
          "etymology": null,
          "gloss": null
        },
        {
          "form": "ஊர!",
          "root": null,
          "urichol": null,
          "etymology": null,
          "gloss": null
        }
      ]
    },
    {
      "lineNumber": 4,
      "text": "ஒரு நின் பாணன் பொய்யன் ஆக,",
      "words": [
        {
          "form": "ஒரு",
          "root": null,
          "urichol": null,
          "etymology": null,
          "gloss": null
        },
        {
          "form": "நின்",
          "root": null,
          "urichol": null,
          "etymology": null,
          "gloss": null
        },
        {
          "form": "பாணன்",
          "root": null,
          "urichol": null,
          "etymology": null,
          "gloss": null
        },
        {
          "form": "பொய்யன்",
          "root": null,
          "urichol": null,
          "etymology": null,
          "gloss": null
        },
        {
          "form": "ஆக,",
          "root": null,
          "urichol": null,
          "etymology": null,
          "gloss": null
        }
      ]
    },
    {
      "lineNumber": 5,
      "text": "உள்ள பாணர் எல்லாம்",
      "words": [
        {
          "form": "உள்ள",
          "root": null,
          "urichol": null,
          "etymology": null,
          "gloss": null
        },
        {
          "form": "பாணர்",
          "root": null,
          "urichol": null,
          "etymology": null,
          "gloss": null
        },
        {
          "form": "எல்லாம்",
          "root": null,
          "urichol": null,
          "etymology": null,
          "gloss": null
        }
      ]
    },
    {
      "lineNumber": 6,
      "text": "கள்வர் போல்வர், நீ அகன்றிசி னோர்க்கே.",
      "words": [
        {
          "form": "கள்வர்",
          "root": null,
          "urichol": null,
          "etymology": null,
          "gloss": null
        },
        {
          "form": "போல்வர்,",
          "root": null,
          "urichol": null,
          "etymology": null,
          "gloss": null
        },
        {
          "form": "நீ",
          "root": null,
          "urichol": null,
          "etymology": null,
          "gloss": null
        },
        {
          "form": "அகன்றிசி",
          "root": null,
          "urichol": null,
          "etymology": null,
          "gloss": null
        },
        {
          "form": "னோர்க்கே.",
          "root": null,
          "urichol": null,
          "etymology": null,
          "gloss": null
        }
      ]
    },
    {
      "lineNumber": 7,
      "text": "- ஓரம் போகியார்.",
      "words": [
        {
          "form": "-",
          "root": null,
          "urichol": null,
          "etymology": null,
          "gloss": null
        },
        {
          "form": "ஓரம்",
          "root": null,
          "urichol": null,
          "etymology": null,
          "gloss": null
        },
        {
          "form": "போகியார்.",
          "root": null,
          "urichol": null,
          "etymology": null,
          "gloss": null
        }
      ]
    }
  ],
  "culturalNotes": [],
  "audioUrl": null,
  "source": "http://www.sangathamizh.com/8thokai/kurunthokai/kurunthokai-குறுந்தொகை127.html",
  "verified": false,
  "number": 127,
  "poet": "ஓரம் போகியார்.",
  "title": "குருகு கொளக் குளித்த கெண்டை அயலது"
}