{
  "id": "purananooru_348",
  "poem": "purananooru",
  "tinai": "unknown",
  "sangamTamil": "வெண்ணெல் அரிஞர் தண்ணுமை வெரீஇக்,\nகண்மடற் கொண்ட தீந்தேன் இரியக்,\nகள்ளரிக்கும் குயம், சிறுசின்\nமீன் சீவும் பாண் சேரி,\nவாய்மொழித் தழும்பன் ஊணூர் அன்ன,\nகுவளை உண்கண் இவளைத், தாயே\nஈனா ளாயினள் ஆயின், ஆனாது\nநிழல்தொறும் நெடுந்தேர் நிற்ப, வயின்தொறும்,\nசெந்நுதல் யானை பிணிப்ப,\nவருந்தல மன் - எம் பெருந்துறை மரனே",
  "urai": "நெல் அறுக்கும்போது தண்ணுமை - மேளம் கொட்டுவர். அதன் ஓசை அதிர்வால் கண்ணகன்ற பனைமடலில் கட்டியிருந்த தேன்கூடு கிழியும். அதில் ஒழுகும் தேன் - கள்ளைப் பானையில் பிடித்துக்கொள்வர். அங்குள்ள வீடுகளில் வயலில் பிடித்த மீன்களின் செதிளைச் சீவுவர். இப்படிப்பட்ட நன்செய் - நில வளம் மிக்க ஊர் ஊணூர் [ஊண் = உணவு]. அதன் அரசன் தழும்பன். தழும்பன் சொன்னசொல் தவறாமல் வழங்குபவன். அவள் அவள் குவளை மலரைத் தின்பது போல அழகான கண் கொண்டவள். இவளை இவளது தாய் பெற்றிருக்காவிட்டால் இங்கே இது நிகழாதே! ஊரிலுள்ள நிழலிலெல்லாம் தேர்கள் நிற்கின்றனவே! மேலும் அங்குள்ள துறைகளில் உள்ள மரங்கள் எல்லாம், குருதியால் செந்நிறம் கொண்ட யானைகள் கட்டப்பட்டு மரங்கள் வருந்துகின்றனவே! இனி நிகழப்போகும் போர் மூளாமல் இருக்குமே!",
  "english": null,
  "lines": [
    {
      "lineNumber": 1,
      "text": "வெண்ணெல் அரிஞர் தண்ணுமை வெரீஇக்,",
      "words": [
        {
          "form": "வெண்ணெல்",
          "root": null,
          "urichol": null,
          "etymology": null,
          "gloss": null
        },
        {
          "form": "அரிஞர்",
          "root": null,
          "urichol": null,
          "etymology": null,
          "gloss": null
        },
        {
          "form": "தண்ணுமை",
          "root": null,
          "urichol": null,
          "etymology": null,
          "gloss": null
        },
        {
          "form": "வெரீஇக்,",
          "root": null,
          "urichol": null,
          "etymology": null,
          "gloss": null
        }
      ]
    },
    {
      "lineNumber": 2,
      "text": "கண்மடற் கொண்ட தீந்தேன் இரியக்,",
      "words": [
        {
          "form": "கண்மடற்",
          "root": null,
          "urichol": null,
          "etymology": null,
          "gloss": null
        },
        {
          "form": "கொண்ட",
          "root": null,
          "urichol": null,
          "etymology": null,
          "gloss": null
        },
        {
          "form": "தீந்தேன்",
          "root": null,
          "urichol": null,
          "etymology": null,
          "gloss": null
        },
        {
          "form": "இரியக்,",
          "root": null,
          "urichol": null,
          "etymology": null,
          "gloss": null
        }
      ]
    },
    {
      "lineNumber": 3,
      "text": "கள்ளரிக்கும் குயம், சிறுசின்",
      "words": [
        {
          "form": "கள்ளரிக்கும்",
          "root": null,
          "urichol": null,
          "etymology": null,
          "gloss": null
        },
        {
          "form": "குயம்,",
          "root": null,
          "urichol": null,
          "etymology": null,
          "gloss": null
        },
        {
          "form": "சிறுசின்",
          "root": null,
          "urichol": null,
          "etymology": null,
          "gloss": null
        }
      ]
    },
    {
      "lineNumber": 4,
      "text": "மீன் சீவும் பாண் சேரி,",
      "words": [
        {
          "form": "மீன்",
          "root": null,
          "urichol": null,
          "etymology": null,
          "gloss": null
        },
        {
          "form": "சீவும்",
          "root": null,
          "urichol": null,
          "etymology": null,
          "gloss": null
        },
        {
          "form": "பாண்",
          "root": null,
          "urichol": null,
          "etymology": null,
          "gloss": null
        },
        {
          "form": "சேரி,",
          "root": null,
          "urichol": null,
          "etymology": null,
          "gloss": null
        }
      ]
    },
    {
      "lineNumber": 5,
      "text": "வாய்மொழித் தழும்பன் ஊணூர் அன்ன,",
      "words": [
        {
          "form": "வாய்மொழித்",
          "root": null,
          "urichol": null,
          "etymology": null,
          "gloss": null
        },
        {
          "form": "தழும்பன்",
          "root": null,
          "urichol": null,
          "etymology": null,
          "gloss": null
        },
        {
          "form": "ஊணூர்",
          "root": null,
          "urichol": null,
          "etymology": null,
          "gloss": null
        },
        {
          "form": "அன்ன,",
          "root": null,
          "urichol": null,
          "etymology": null,
          "gloss": null
        }
      ]
    },
    {
      "lineNumber": 6,
      "text": "குவளை உண்கண் இவளைத், தாயே",
      "words": [
        {
          "form": "குவளை",
          "root": null,
          "urichol": null,
          "etymology": null,
          "gloss": null
        },
        {
          "form": "உண்கண்",
          "root": null,
          "urichol": null,
          "etymology": null,
          "gloss": null
        },
        {
          "form": "இவளைத்,",
          "root": null,
          "urichol": null,
          "etymology": null,
          "gloss": null
        },
        {
          "form": "தாயே",
          "root": null,
          "urichol": null,
          "etymology": null,
          "gloss": null
        }
      ]
    },
    {
      "lineNumber": 7,
      "text": "ஈனா ளாயினள் ஆயின், ஆனாது",
      "words": [
        {
          "form": "ஈனா",
          "root": null,
          "urichol": null,
          "etymology": null,
          "gloss": null
        },
        {
          "form": "ளாயினள்",
          "root": null,
          "urichol": null,
          "etymology": null,
          "gloss": null
        },
        {
          "form": "ஆயின்,",
          "root": null,
          "urichol": null,
          "etymology": null,
          "gloss": null
        },
        {
          "form": "ஆனாது",
          "root": null,
          "urichol": null,
          "etymology": null,
          "gloss": null
        }
      ]
    },
    {
      "lineNumber": 8,
      "text": "நிழல்தொறும் நெடுந்தேர் நிற்ப, வயின்தொறும்,",
      "words": [
        {
          "form": "நிழல்தொறும்",
          "root": null,
          "urichol": null,
          "etymology": null,
          "gloss": null
        },
        {
          "form": "நெடுந்தேர்",
          "root": null,
          "urichol": null,
          "etymology": null,
          "gloss": null
        },
        {
          "form": "நிற்ப,",
          "root": null,
          "urichol": null,
          "etymology": null,
          "gloss": null
        },
        {
          "form": "வயின்தொறும்,",
          "root": null,
          "urichol": null,
          "etymology": null,
          "gloss": null
        }
      ]
    },
    {
      "lineNumber": 9,
      "text": "செந்நுதல் யானை பிணிப்ப,",
      "words": [
        {
          "form": "செந்நுதல்",
          "root": null,
          "urichol": null,
          "etymology": null,
          "gloss": null
        },
        {
          "form": "யானை",
          "root": null,
          "urichol": null,
          "etymology": null,
          "gloss": null
        },
        {
          "form": "பிணிப்ப,",
          "root": null,
          "urichol": null,
          "etymology": null,
          "gloss": null
        }
      ]
    },
    {
      "lineNumber": 10,
      "text": "வருந்தல மன் - எம் பெருந்துறை மரனே",
      "words": [
        {
          "form": "வருந்தல",
          "root": null,
          "urichol": null,
          "etymology": null,
          "gloss": null
        },
        {
          "form": "மன்",
          "root": null,
          "urichol": null,
          "etymology": null,
          "gloss": null
        },
        {
          "form": "-",
          "root": null,
          "urichol": null,
          "etymology": null,
          "gloss": null
        },
        {
          "form": "எம்",
          "root": null,
          "urichol": null,
          "etymology": null,
          "gloss": null
        },
        {
          "form": "பெருந்துறை",
          "root": null,
          "urichol": null,
          "etymology": null,
          "gloss": null
        },
        {
          "form": "மரனே",
          "root": null,
          "urichol": null,
          "etymology": null,
          "gloss": null
        }
      ]
    }
  ],
  "culturalNotes": [],
  "audioUrl": null,
  "source": "http://www.sangathamizh.com/8thokai/purananooru/purananooru-புறநானூறு348.html",
  "verified": false,
  "number": 348,
  "poet": "ஔவையார்",
  "heading": "வேந்தர் முற்றுகையிட்டாலும் பணிந்து பெண்கொடாத மறவன்"
}