{
  "id": "naladiyar_301",
  "poem": "naladiyar",
  "number": 301,
  "title": "இரவச்சம்",
  "heading": "2.31",
  "poet": "பல புலவர்கள்",
  "tinai": "unknown",
  "sangamTamil": "நம்மாலே யாவரிந் நல்கூர்ந்தார் எஞ்ஞான்றும்\nதம்மாலாம் ஆக்கம் இலரென்று - தம்மை\nமருண்ட மனத்தார்பின் செல்பவோ தாமும்\nதெருண்ட அறிவி னவர்.",
  "urai": null,
  "english": "Ignorant condescending patrons. Will men themselves possessed of clear discerning knowledge follow after those who have yielded themselves up to mental bewilderment, and who (erroneously) say (of suppliants), ‘These poor folks depend entirely on us, evermore are they without resources in themselves ?'",
  "englishMeta": {
    "provider": "projectmadurai",
    "model": "pope-ellis-1893",
    "promptVersion": "public-domain-edition",
    "generatedAt": "2026-10-27T18:30:20.554060+00:00",
    "runId": "pathinen-ingest"
  },
  "lines": [
    {
      "lineNumber": 1,
      "text": "நம்மாலே யாவரிந் நல்கூர்ந்தார் எஞ்ஞான்றும்",
      "words": [
        {
          "form": "நம்மாலே",
          "root": null,
          "urichol": null,
          "etymology": null,
          "gloss": null
        },
        {
          "form": "யாவரிந்",
          "root": null,
          "urichol": null,
          "etymology": null,
          "gloss": null
        },
        {
          "form": "நல்கூர்ந்தார்",
          "root": null,
          "urichol": null,
          "etymology": null,
          "gloss": null
        },
        {
          "form": "எஞ்ஞான்றும்",
          "root": null,
          "urichol": null,
          "etymology": null,
          "gloss": null
        }
      ]
    },
    {
      "lineNumber": 2,
      "text": "தம்மாலாம் ஆக்கம் இலரென்று - தம்மை",
      "words": [
        {
          "form": "தம்மாலாம்",
          "root": null,
          "urichol": null,
          "etymology": null,
          "gloss": null
        },
        {
          "form": "ஆக்கம்",
          "root": null,
          "urichol": null,
          "etymology": null,
          "gloss": null
        },
        {
          "form": "இலரென்று",
          "root": null,
          "urichol": null,
          "etymology": null,
          "gloss": null
        },
        {
          "form": "-",
          "root": null,
          "urichol": null,
          "etymology": null,
          "gloss": null
        },
        {
          "form": "தம்மை",
          "root": null,
          "urichol": null,
          "etymology": null,
          "gloss": null
        }
      ]
    },
    {
      "lineNumber": 3,
      "text": "மருண்ட மனத்தார்பின் செல்பவோ தாமும்",
      "words": [
        {
          "form": "மருண்ட",
          "root": null,
          "urichol": null,
          "etymology": null,
          "gloss": null
        },
        {
          "form": "மனத்தார்பின்",
          "root": null,
          "urichol": null,
          "etymology": null,
          "gloss": null
        },
        {
          "form": "செல்பவோ",
          "root": null,
          "urichol": null,
          "etymology": null,
          "gloss": null
        },
        {
          "form": "தாமும்",
          "root": null,
          "urichol": null,
          "etymology": null,
          "gloss": null
        }
      ]
    },
    {
      "lineNumber": 4,
      "text": "தெருண்ட அறிவி னவர்.",
      "words": [
        {
          "form": "தெருண்ட",
          "root": null,
          "urichol": null,
          "etymology": null,
          "gloss": null
        },
        {
          "form": "அறிவி",
          "root": null,
          "urichol": null,
          "etymology": null,
          "gloss": null
        },
        {
          "form": "னவர்.",
          "root": null,
          "urichol": null,
          "etymology": null,
          "gloss": null
        }
      ]
    }
  ],
  "culturalNotes": [],
  "audioUrl": null,
  "source": "https://www.projectmadurai.org/pm_etexts/utf8/pmuni0016.html; https://www.projectmadurai.org/pm_etexts/utf8/pmuni0711.html",
  "verified": false
}