{
  "id": "thirukkural_0846",
  "poem": "thirukkural",
  "number": 846,
  "title": "புல்லறிவாண்மை",
  "heading": "2.3.12",
  "poet": "திருவள்ளுவர்",
  "tinai": "unknown",
  "sangamTamil": "அற்றம் மறைத்தலோ புல்லறிவு தம்வயின்\nகுற்றம் மறையா வழி.",
  "urai": null,
  "english": "Fools are they who their nakedness conceal, And yet their faults unveiled reveal.",
  "englishMeta": {
    "provider": "projectmadurai",
    "model": "pope-drew-lazarus-ellis-1886",
    "promptVersion": "public-domain-edition",
    "generatedAt": "2026-10-27T18:28:31.369281+00:00",
    "runId": "pathinen-ingest"
  },
  "lines": [
    {
      "lineNumber": 1,
      "text": "அற்றம் மறைத்தலோ புல்லறிவு தம்வயின்",
      "words": [
        {
          "form": "அற்றம்",
          "root": null,
          "urichol": null,
          "etymology": null,
          "gloss": null
        },
        {
          "form": "மறைத்தலோ",
          "root": null,
          "urichol": null,
          "etymology": null,
          "gloss": null
        },
        {
          "form": "புல்லறிவு",
          "root": null,
          "urichol": null,
          "etymology": null,
          "gloss": null
        },
        {
          "form": "தம்வயின்",
          "root": null,
          "urichol": null,
          "etymology": null,
          "gloss": null
        }
      ]
    },
    {
      "lineNumber": 2,
      "text": "குற்றம் மறையா வழி.",
      "words": [
        {
          "form": "குற்றம்",
          "root": null,
          "urichol": null,
          "etymology": null,
          "gloss": null
        },
        {
          "form": "மறையா",
          "root": null,
          "urichol": null,
          "etymology": null,
          "gloss": null
        },
        {
          "form": "வழி.",
          "root": null,
          "urichol": null,
          "etymology": null,
          "gloss": null
        }
      ]
    }
  ],
  "culturalNotes": [],
  "audioUrl": null,
  "source": "https://www.projectmadurai.org/pm_etexts/utf8/pmuni0001.html; https://www.projectmadurai.org/pm_etexts/utf8/pmuni0153.html",
  "verified": false
}