{
  "id": "thirukkural_0982",
  "poem": "thirukkural",
  "number": 982,
  "title": "சான்றாண்மை",
  "heading": "2.4.4",
  "poet": "திருவள்ளுவர்",
  "tinai": "unknown",
  "sangamTamil": "குணநலம் சான்றோர் நலனே பிறநலம்\nஎந்நலத்து உள்ளதூஉம் அன்று.",
  "urai": null,
  "english": "The good of inward excellence they claim, The perfect men; all other good is only good in name.",
  "englishMeta": {
    "provider": "projectmadurai",
    "model": "pope-drew-lazarus-ellis-1886",
    "promptVersion": "public-domain-edition",
    "generatedAt": "2026-10-27T18:28:31.369281+00:00",
    "runId": "pathinen-ingest"
  },
  "lines": [
    {
      "lineNumber": 1,
      "text": "குணநலம் சான்றோர் நலனே பிறநலம்",
      "words": [
        {
          "form": "குணநலம்",
          "root": null,
          "urichol": null,
          "etymology": null,
          "gloss": null
        },
        {
          "form": "சான்றோர்",
          "root": null,
          "urichol": null,
          "etymology": null,
          "gloss": null
        },
        {
          "form": "நலனே",
          "root": null,
          "urichol": null,
          "etymology": null,
          "gloss": null
        },
        {
          "form": "பிறநலம்",
          "root": null,
          "urichol": null,
          "etymology": null,
          "gloss": null
        }
      ]
    },
    {
      "lineNumber": 2,
      "text": "எந்நலத்து உள்ளதூஉம் அன்று.",
      "words": [
        {
          "form": "எந்நலத்து",
          "root": null,
          "urichol": null,
          "etymology": null,
          "gloss": null
        },
        {
          "form": "உள்ளதூஉம்",
          "root": null,
          "urichol": null,
          "etymology": null,
          "gloss": null
        },
        {
          "form": "அன்று.",
          "root": null,
          "urichol": null,
          "etymology": null,
          "gloss": null
        }
      ]
    }
  ],
  "culturalNotes": [],
  "audioUrl": null,
  "source": "https://www.projectmadurai.org/pm_etexts/utf8/pmuni0001.html; https://www.projectmadurai.org/pm_etexts/utf8/pmuni0153.html",
  "verified": false
}