{
  "id": "natrinai_265",
  "poem": "natrinai",
  "tinai": "kurinji",
  "sangamTamil": "இறுகு புனம் மேய்ந்த அறு கோட்டு முற்றல்\nஅள்ளல் ஆடிய புள்ளி வரிக் கலை\nவீளை அம்பின் வில்லோர் பெருமகன்,\nபூந் தோள் யாப்பின் மிஞிலி, காக்கும்\nபாரத்து அன்ன - ஆர மார்பின்\nசிறு கோற் சென்னி ஆரேற்றன்ன\nமாரி வண் மகிழ் ஓரி கொல்லிக்\nகலி மயில் கலாவத்து அன்ன, இவள்\nஒலி மென் கூந்தல் நம் வயினானே.\n- பரணர்.",
  "urai": "காய்ந்த புல்லை மேய்கின்ற உதிர்ந்த கொம்பினையுடைய முதிர்ச்சியையுடைய சேற்றில் ஓட்டி வருந்தச் செய்த புள்ளியையும் வரியையும் உடைய கலைமானை; எய்யும் ஒலியையுடைய அம்பினையும் வில்லினையுமுடைய வீரர் தலைவனாகிய பொலிவு பொருந்திய தோளிலே கவசம் பூட்டிய மிஞிலி என்பவனாலே காவல் செய்து வருகின்ற; பாரம் என்னும் ஊரைப்போன்ற ஆத்திமாலையையுடைய மார்பையுடைய சிலவாகிய ஊர்களை ஆட்சிகொண்ட செங்கோலையுடைய சோழனுடைய; ஆரேற்றைப் போன்ற இவளுடைய தலைவியாகிய மழை போன்ற கொடையும் கள்ளுணவுமுடைய ஓரியென்பவனது கொல்லி மலையிலிருக்கின்ற; செருக்கிய மயிலைப் போன்ற நம் காதலியாவாள்; அம் மயிலின் கலாபம் போன்ற தழைந்த மெல்லிய கூந்தலையுடையாள்; நம்பாலள் அல்லளோ? ஆதலின் நெஞ்சமே கவலை கொள்ளாதே; நின்செயல் விரைய முடிவு பெறுங்காண்!",
  "english": null,
  "lines": [
    {
      "lineNumber": 1,
      "text": "இறுகு புனம் மேய்ந்த அறு கோட்டு முற்றல்",
      "words": [
        {
          "form": "இறுகு",
          "root": null,
          "urichol": null,
          "etymology": null,
          "gloss": null
        },
        {
          "form": "புனம்",
          "root": null,
          "urichol": null,
          "etymology": null,
          "gloss": null
        },
        {
          "form": "மேய்ந்த",
          "root": null,
          "urichol": null,
          "etymology": null,
          "gloss": null
        },
        {
          "form": "அறு",
          "root": null,
          "urichol": null,
          "etymology": null,
          "gloss": null
        },
        {
          "form": "கோட்டு",
          "root": null,
          "urichol": null,
          "etymology": null,
          "gloss": null
        },
        {
          "form": "முற்றல்",
          "root": null,
          "urichol": null,
          "etymology": null,
          "gloss": null
        }
      ]
    },
    {
      "lineNumber": 2,
      "text": "அள்ளல் ஆடிய புள்ளி வரிக் கலை",
      "words": [
        {
          "form": "அள்ளல்",
          "root": null,
          "urichol": null,
          "etymology": null,
          "gloss": null
        },
        {
          "form": "ஆடிய",
          "root": null,
          "urichol": null,
          "etymology": null,
          "gloss": null
        },
        {
          "form": "புள்ளி",
          "root": null,
          "urichol": null,
          "etymology": null,
          "gloss": null
        },
        {
          "form": "வரிக்",
          "root": null,
          "urichol": null,
          "etymology": null,
          "gloss": null
        },
        {
          "form": "கலை",
          "root": null,
          "urichol": null,
          "etymology": null,
          "gloss": null
        }
      ]
    },
    {
      "lineNumber": 3,
      "text": "வீளை அம்பின் வில்லோர் பெருமகன்,",
      "words": [
        {
          "form": "வீளை",
          "root": null,
          "urichol": null,
          "etymology": null,
          "gloss": null
        },
        {
          "form": "அம்பின்",
          "root": null,
          "urichol": null,
          "etymology": null,
          "gloss": null
        },
        {
          "form": "வில்லோர்",
          "root": null,
          "urichol": null,
          "etymology": null,
          "gloss": null
        },
        {
          "form": "பெருமகன்,",
          "root": null,
          "urichol": null,
          "etymology": null,
          "gloss": null
        }
      ]
    },
    {
      "lineNumber": 4,
      "text": "பூந் தோள் யாப்பின் மிஞிலி, காக்கும்",
      "words": [
        {
          "form": "பூந்",
          "root": null,
          "urichol": null,
          "etymology": null,
          "gloss": null
        },
        {
          "form": "தோள்",
          "root": null,
          "urichol": null,
          "etymology": null,
          "gloss": null
        },
        {
          "form": "யாப்பின்",
          "root": null,
          "urichol": null,
          "etymology": null,
          "gloss": null
        },
        {
          "form": "மிஞிலி,",
          "root": null,
          "urichol": null,
          "etymology": null,
          "gloss": null
        },
        {
          "form": "காக்கும்",
          "root": null,
          "urichol": null,
          "etymology": null,
          "gloss": null
        }
      ]
    },
    {
      "lineNumber": 5,
      "text": "பாரத்து அன்ன - ஆர மார்பின்",
      "words": [
        {
          "form": "பாரத்து",
          "root": null,
          "urichol": null,
          "etymology": null,
          "gloss": null
        },
        {
          "form": "அன்ன",
          "root": null,
          "urichol": null,
          "etymology": null,
          "gloss": null
        },
        {
          "form": "-",
          "root": null,
          "urichol": null,
          "etymology": null,
          "gloss": null
        },
        {
          "form": "ஆர",
          "root": null,
          "urichol": null,
          "etymology": null,
          "gloss": null
        },
        {
          "form": "மார்பின்",
          "root": null,
          "urichol": null,
          "etymology": null,
          "gloss": null
        }
      ]
    },
    {
      "lineNumber": 6,
      "text": "சிறு கோற் சென்னி ஆரேற்றன்ன",
      "words": [
        {
          "form": "சிறு",
          "root": null,
          "urichol": null,
          "etymology": null,
          "gloss": null
        },
        {
          "form": "கோற்",
          "root": null,
          "urichol": null,
          "etymology": null,
          "gloss": null
        },
        {
          "form": "சென்னி",
          "root": null,
          "urichol": null,
          "etymology": null,
          "gloss": null
        },
        {
          "form": "ஆரேற்றன்ன",
          "root": null,
          "urichol": null,
          "etymology": null,
          "gloss": null
        }
      ]
    },
    {
      "lineNumber": 7,
      "text": "மாரி வண் மகிழ் ஓரி கொல்லிக்",
      "words": [
        {
          "form": "மாரி",
          "root": null,
          "urichol": null,
          "etymology": null,
          "gloss": null
        },
        {
          "form": "வண்",
          "root": null,
          "urichol": null,
          "etymology": null,
          "gloss": null
        },
        {
          "form": "மகிழ்",
          "root": null,
          "urichol": null,
          "etymology": null,
          "gloss": null
        },
        {
          "form": "ஓரி",
          "root": null,
          "urichol": null,
          "etymology": null,
          "gloss": null
        },
        {
          "form": "கொல்லிக்",
          "root": null,
          "urichol": null,
          "etymology": null,
          "gloss": null
        }
      ]
    },
    {
      "lineNumber": 8,
      "text": "கலி மயில் கலாவத்து அன்ன, இவள்",
      "words": [
        {
          "form": "கலி",
          "root": null,
          "urichol": null,
          "etymology": null,
          "gloss": null
        },
        {
          "form": "மயில்",
          "root": null,
          "urichol": null,
          "etymology": null,
          "gloss": null
        },
        {
          "form": "கலாவத்து",
          "root": null,
          "urichol": null,
          "etymology": null,
          "gloss": null
        },
        {
          "form": "அன்ன,",
          "root": null,
          "urichol": null,
          "etymology": null,
          "gloss": null
        },
        {
          "form": "இவள்",
          "root": null,
          "urichol": null,
          "etymology": null,
          "gloss": null
        }
      ]
    },
    {
      "lineNumber": 9,
      "text": "ஒலி மென் கூந்தல் நம் வயினானே.",
      "words": [
        {
          "form": "ஒலி",
          "root": null,
          "urichol": null,
          "etymology": null,
          "gloss": null
        },
        {
          "form": "மென்",
          "root": null,
          "urichol": null,
          "etymology": null,
          "gloss": null
        },
        {
          "form": "கூந்தல்",
          "root": null,
          "urichol": null,
          "etymology": null,
          "gloss": null
        },
        {
          "form": "நம்",
          "root": null,
          "urichol": null,
          "etymology": null,
          "gloss": null
        },
        {
          "form": "வயினானே.",
          "root": null,
          "urichol": null,
          "etymology": null,
          "gloss": null
        }
      ]
    },
    {
      "lineNumber": 10,
      "text": "- பரணர்.",
      "words": [
        {
          "form": "-",
          "root": null,
          "urichol": null,
          "etymology": null,
          "gloss": null
        },
        {
          "form": "பரணர்.",
          "root": null,
          "urichol": null,
          "etymology": null,
          "gloss": null
        }
      ]
    }
  ],
  "culturalNotes": [],
  "audioUrl": null,
  "source": "http://www.sangathamizh.com/8thokai/natrinai/natrinai-நற்றிணை265.html",
  "verified": false,
  "number": 265,
  "poet": "பரணர்.",
  "title": "பாரம் எறிந்த மிஞிலி அன்ன அழகு"
}